Date, Title, Artist, Genre, ReleaseDate, Album, Label
2025-06-24,Free Bird,Lynyrd Skynyrd,Rock,Unknown,Pronounced Leh-Nerd Skin-Nerd,Geffen
2025-06-24,Save Me,Jelly Roll,Rap,Unknown,Self Medicated,It Goes Up Entertainment - War Dog
2025-06-24,Drink In My Hand,Eric Church,Country,Unknown,Chief,EMI Records Nashville
2025-06-24,Don't Stop Believing (Harmonica Version),Harp Man Of Perth,Indie Rock,Unknown,Don't Stop Believing (Harmonica Version) - Single,Harp Man Of Perth
2025-06-24,Don't Stop Believin',Journey,Rock,03-06-1981,The Essential Journey,Columbia
2025-06-24,Thunderstruck,AC/DC,Hard Rock,Unknown,The Razors Edge,Columbia
2025-06-24,Tequila Makes Her Clothes Fall Off,Joe Nichols,Country,Unknown,III,Show Dog Universal Music
2025-06-24,Simple Man,Lynyrd Skynyrd,Rock,Unknown,Pronounced Leh-Nerd Skin-Nerd,Geffen
2025-06-24,Black Betty,Ram Jam,Rock,Unknown,Ram Jam,Epic
2025-06-24,Cotton Eye Joe,Rednex,Pop,11-08-1994,Sex & Violins,Muunshine Muusic
2025-06-24,Summertime,Kenny Chesney,Country,Unknown,The Road and the Radio,BNA Records Label
2025-06-24,Bohemian Rhapsody,Queen,Rock,Unknown,A Night at the Opera,EMI
2025-06-24,Beer For My Horses (feat. Willie Nelson),Toby Keith,Country,Unknown,America - EP,UME - Global Clearing House
2025-06-24,Epic,Faith No More,Hard Rock,20-06-1989,The Real Thing,London Records
2025-06-24,Whatever You Like,T.I.,Rap,Unknown,Paper Trail,"Grand Hustle, LLC"
2025-06-24,I Write Sins Not Tragedies,Panic! At the Disco,Alternative,Unknown,A Fever You Can't Sweat Out,Fueled By Ramen/ADA
2025-06-24,Whole Damn Town,Turnpike Troubadours,Country,21-08-2010,Diamonds & Gasoline,Bossier City Records
2025-06-24,Look What You Made Me Do,Taylor Swift,Pop,Unknown,reputation,Taylor Swift
2025-06-24,Dancing Queen,ABBA,Pop,Unknown,Arrival (Bonus Track Version),Polar Music International AB
2025-06-24,Don't Stop Believin',Journey,Rock,Unknown,The Essential Journey,Columbia
2025-06-24,Don't Stop Believing (Harmonica Version),Harp Man Of Perth,Indie Rock,Unknown,Don't Stop Believing (Harmonica Version) - Single,Harp Man Of Perth
2025-06-24,Drunk On a Plane,Dierks Bentley,Country,Unknown,Riser,Capitol Records Nashville
2025-06-24,Danger Zone,Kenny Loggins,Pop,Unknown,The Essential Kenny Loggins,Columbia/Legacy
2025-06-24,Whole Damn Town,Turnpike Troubadours,Country,Unknown,Diamonds & Gasoline,Bossier City Records
2025-06-24,Rockstar,Nickelback,Rock,Unknown,All the Right Reasons,Roadrunner Records
2025-06-24,"No Shoes, No Shirt, No Problems",Kenny Chesney,Country,23-04-2002,"No Shoes, No Shirt, No Problems",BNA Records Label
2025-06-24,STRAIGHT LINE,Keith Urban,Country,Unknown,HIGH,Keith Urban LP12
2025-06-24,Low Life (feat. The Weeknd),Future,Hip-Hop/Rap,Unknown,EVOL,Epic/Freebandz/A1
2025-06-24,Rehab,Rihanna,R&B/Soul,Unknown,Good Girl Gone Bad (Reloaded - UK & Oz CD),Def Jam Recordings
2025-06-24,Pon de Replay,Rihanna,Pop,Unknown,Music of the Sun,Def Jam Recordings
2025-06-24,Yeah Glo! (Extended),GloRilla,Hip-Hop/Rap,Unknown,Yeah Glo! (Alternate Versions),CMG/Interscope Records
2025-06-24,Yeah Glo!,GloRilla,Hip-Hop/Rap,08-02-2024,Yeah Glo! (Alternate Versions),CMG/Interscope Records
2025-06-24,Don't Stop The Music,Rihanna,R&B/Soul,Unknown,Good Girl Gone Bad: Reloaded,Def Jam Recordings
2025-06-24,Yo,Dr Suess Johnny,Hip-Hop,Unknown,The Cat in the Hat,Shady records
2025-06-24,You (feat. Lil Wayne),Lloyd,R&B/Soul,01-01-2007,You (UK Radio Edit) - Single,"I.G. Records, Inc./Universal Records"
2025-06-24,You (Edited),Lloyd,R&B/Soul,23-10-2006,You - Single,"I.G. Records, Inc./Universal Records"
2025-06-24,You (Without Rap),Lloyd,R&B/Soul,Unknown,You - Single,"I.G. Records, Inc./Universal Records"
2025-06-24,You (Edited),Lloyd,R&B/Soul,23-10-2006,You - Single,"I.G. Records, Inc./Universal Records"
2025-06-24,You (Without Rap),Lloyd,R&B/Soul,Unknown,You - Single,"I.G. Records, Inc./Universal Records"
2025-06-24,You (feat. Lil Wayne),Lloyd,R&B/Soul,Unknown,You (UK Radio Edit) - Single,"I.G. Records, Inc./Universal Records"
2025-06-24,6 Months Later,Megan Moroney,Country,Unknown,6 Months Later - Single,Columbia Nashville/Columbia Records
2025-06-24,American Pie,Don Mclean,Pop,01-01-1971,American Pie (Expanded Edition),Capitol Records
2025-06-24,Wild Boy (feat. Waka Flocka Flame),mgk,Hip-Hop/Rap,Unknown,Lace Up,Bad Boy / Interscope
2025-06-24,Wild Boy (feat. Machine Gun Kelly),Waka Flocka Flame,Hip-Hop/Rap,Unknown,Waka Flocka Myers 3,RBC Records
2025-06-24,Medley: Let Me Talk to You / My Love (feat. T.I.),Justin Timberlake,Pop,Unknown,FutureSex/LoveSounds,Jive
2025-06-24,My Love (feat. T.I.),Justin Timberlake,Pop,08-09-2006,FutureSex/LoveSounds (Deluxe Edition),Jive
2025-06-24,05 Cut Killer Show - La Fouine 2,Cut Killer Show,Hip-Hop/Rap,Unknown,Cut Killer Show - La Fouine 2,Cut Killer Show
2025-06-24,Medley: Let Me Talk to You / My Love (feat. T.I.),Justin Timberlake,Pop,Unknown,FutureSex/LoveSounds,Jive
2025-06-24,All That Matters,Justin Bieber,Pop,Unknown,Journals,RBMG/Def Jam
2025-06-24,Confident (feat. Chance The Rapper),Justin Bieber,Pop,Unknown,Journals,RBMG/Def Jam
2025-06-24,Sure Thing,Miguel,R&B/Soul,26-11-2010,All I Want Is You,Jive
2025-06-24,Ride Wit Me (feat. City Spud),Nelly,Hip-Hop/Rap,Unknown,Country Grammar,Motown
2025-06-25,One Thing Right,Marshmello & Kane Brown,Pop,Unknown,One Thing Right - Single,Joytime Collective
2025-06-25,Drunk Me (R3HAB Remix),Mitchell Tenpenny,Pop,Unknown,Drunk Me (R3HAB Remix) - Single,Riser House Entertainment/Columbia Nashville
2025-06-25,Cruise,Florida Georgia Line,Country,01-04-2012,Here's to the Good Times,Big Machine Label Group
2025-06-25,Round Here,Florida Georgia Line,Country,Unknown,Here's to the Good Times,Big Machine Label Group
2025-06-25,Taste,Sabrina Carpenter,Pop,Unknown,Short n' Sweet,Island Records
2025-06-25,Please Please Please,Sabrina Carpenter,Pop,Unknown,Short n' Sweet,Island Records
2025-06-25,Whole Damn Town,Turnpike Troubadours,Country,Unknown,Diamonds & Gasoline,Bossier City Records
2025-06-25,Epic,Faith No More,Hard Rock,Unknown,The Real Thing,London Records
2025-06-25,Pink Pony Club,Chappell Roan,Pop,03-04-2020,The Rise and Fall of a Midwest Princess,Chappell Roan PS/ Island
2025-06-25,Umbrella (feat. JAY-Z) [Travis Barker Remix],Rihanna,R&B/Soul,Unknown,Unknown Album,Unknown Label
2025-06-25,All The Things She Said,t.A.T.u.,Pop,19-08-2002,200 KM/H In The Wrong Lane (10th Anniversary Edition),Interscope
2025-06-25,I Wanna Be Bad (No Rap With Vocorder),Willa Ford,Pop,Unknown,I Wanna Be Bad - Single,Lava/Atlantic
2025-06-25,I Love It (feat. Charli XCX),Icona Pop,Pop,09-05-2012,This Is... Icona Pop,Record Company TEN/Big Beat/ATL
2025-06-25,Disco Inferno,50 Cent,Hip-Hop/Rap,Unknown,The Massacre,Aftermath/Shady
2025-06-25,Gimme More,Britney Spears,Pop,31-08-2007,Blackout (Deluxe Version),Jive
2025-06-25,Die Young,Kesha,Pop,Unknown,Warrior (Expanded Edition),Kemosabe Records/RCA Records
2025-06-25,Blah Blah Blah (feat. 3OH!3),Kesha,Pop,Unknown,Blah Blah Blah - Single,RCA Records Label
2025-06-25,Leave (Get Out),JoJo,R&B/Soul,Unknown,JoJo,Blackground Records
2025-06-25,Can't Fight the Moonlight,LeAnn Rimes,Country,Unknown,I Need You,Curb Records
2025-06-25,Evacuate the Dancefloor,Cascada,Dance,Unknown,Evacuate the Dancefloor,Zoo Digital
2025-06-25,Rumors,Lindsay Lohan,Vocal,Unknown,Speak,Universal Records
2025-06-25,Stranglehold,Ted Nugent,Rock,Unknown,Ted Nugent,Epic/Legacy
2025-06-25,Boom Clap,Charli xcx,Pop,19-05-2014,SUCKER,Asylum
2025-06-25,Danger Zone,Kenny Loggins,Pop,Unknown,The Essential Kenny Loggins,Columbia/Legacy
2025-06-25,99 Red Balloons (Club Mix),Nena,Pop,Unknown,Maxis & Mixes,BMG Rights Management GmbH
2025-06-25,99 Luftballons,Nena,Pop,01-01-1983,Nena Live '98,Polydor
2025-06-25,99 Red Balloons (Club Mix),Nena,Pop,01-01-1983,Maxis & Mixes,BMG Rights Management GmbH
2025-06-25,Candy,Mandy Moore,Pop,17-08-1999,So Real,Epic/550 Music
2025-06-25,Strut,Sheena Easton,Pop,02-10-1984,A Private Heaven (Remastered),RT Industries
2025-06-25,Tonight Is The Night (feat. Kayo),Le Click,Dance,Unknown,Tonight Is The Night (feat. Kayo),Sony Music Catalog
2025-06-25,Barracuda,Heart,Rock,Unknown,Little Queen,Epic/Portrait
2025-06-25,Me & U,Cassie,R&B/Soul,Unknown,Cassie,Bad Boy Records
2025-06-25,Me & U (International),Cassie,Dance,Unknown,Unknown Album,Unknown Label
2025-06-25,Me & U,Cassie,R&B/Soul,Unknown,Cassie,Bad Boy Records
2025-06-25,Escapade,Janet Jackson,Pop,Unknown,Rhythm Nation 1814,A&M
2025-06-25,Stronger (What Doesn't Kill You),Kelly Clarkson,Pop,Unknown,Greatest Hits - Chapter One (Deluxe Version),RCA Records Label
2025-06-25,Easy (feat. Bow Wow & Bow Wow),Paula DeAnda,Pop,15-08-2006,Easy - Single,Arista
2025-06-25,I Want You,Paris Hilton,Pop,Unknown,Paris,Warner Records
2025-06-25,Beautiful Stranger (William Orbit Radio Edit),Madonna,Pop,Unknown,Beautiful Stranger (Remixes) - EP,Rhino/Warner Records
2025-06-25,Drunk (And I Don't Wanna Go Home),Elle King & Miranda Lambert,Alternative,Unknown,Come Get Your Wife,Sony Music Nashville/RCA Records
2025-06-25,Return Of The Mack,Mark Morrison,R&B/Soul,18-03-1996,Return Of The Mack - Single,All Around The World
2025-06-25,Magic Melody,BeFour,German Pop,Unknown,Unknown Album,Unknown Label
2025-06-25,Around the World (La La La La La) [Radio Version],A Touch of Class,Pop,09-05-2000,Planet Pop,King Size
2025-06-25,Pop,Tecno,Unknown Genre,Unknown,Unknown Album,Unknown Label
2025-06-25,Around the World (La La La La La) [Radio Version],A Touch of Class,Pop,Unknown,Planet Pop,King Size
2025-06-25,Magic Melody,BeFour,German Pop,Unknown,Unknown Album,Unknown Label
2025-06-25,Pink Pony Club,Chappell Roan,Pop,03-04-2020,The Rise and Fall of a Midwest Princess,Chappell Roan PS/ Island
2025-06-25,All I Wanna Do,Sheryl Crow,Pop,03-08-1993,Tuesday Night Music Club,A&M
2025-06-25,Tearin' Up My Heart,*NSYNC,Pop,Unknown,*NSYNC: Greatest Hits,Jive
2025-06-25,Tearin' Up My Heart (Extended Version),*NSYNC,Pop,Unknown,*NSYNC,Ariola
2025-06-25,Tearin' Up My Heart,*NSYNC,Pop,Unknown,*NSYNC: Greatest Hits,Jive
2025-06-25,I Surrender (To the Spirit of the Night),Samantha Fox,Pop,01-01-1986,Touch Me,Ariola Express
2025-06-25,I Want You,Savage Garden,Pop,Unknown,Savage Garden,Sony Music Entertainment
2025-06-25,To the Moon & Back,Savage Garden,Pop,04-11-1996,Savage Garden (Original Version),Sony Music Entertainment
2025-06-25,I Want Candy,Bow Wow Wow,Alternative,28-05-1982,"Love, Peace & Harmony the Best of Bow Wow Wow",Sony BMG Music Entertainment
2025-06-25,I Want Candy (Remix),Bow Wow Wow,Pop,Unknown,Unknown Album,Unknown Label
2025-06-25,I Want Candy,Bow Wow Wow,Alternative,28-05-1982,"Love, Peace & Harmony the Best of Bow Wow Wow",Sony BMG Music Entertainment
2025-06-25,I Want Candy,KIDZ BOP Kids,Children's Music,Unknown,Kidz Bop 80s Gold,Kidz Bop
2025-06-25,Caught Up,USHER,R&B/Soul,23-03-2004,Confessions (20th Anniversary Edition),LaFace/Legacy
2025-06-25,Higher Power,Boston,Rock,Unknown,Greatest Hits,Epic
